{
    "$schema": "http://json-schema.org/draft-07/schema#",
    "properties": {
        "_id": {
            "type": "number"
        },
        "description": {
            "type": "string"
        },
        "id": {
            "type": "string"
        },
        "name": {
            "type": "string"
        },
        "processing": {
            "items": {
                "properties": {
                    "_id": {
                        "type": "number"
                    },
                    "amount": {
                        "type": "number"
                    },
                    "id": {
                        "type": "string"
                    },
                    "name": {
                        "type": "string"
                    }
                },
                "required": [
                    "_id",
                    "amount",
                    "id",
                    "name"
                ],
                "type": "object"
            },
            "type": "array"
        },
        "recipes": {
            "items": {
                "properties": {
                    "_id": {
                        "type": "number"
                    },
                    "id": {
                        "type": "string"
                    },
                    "name": {
                        "type": "string"
                    }
                },
                "required": [
                    "_id",
                    "id",
                    "name"
                ],
                "type": "object"
            },
            "type": "array"
        },
        "source": {
            "items": {
                "type": "string"
            },
            "type": "array"
        }
    },
    "required": [
        "_id",
        "description",
        "id",
        "name"
    ],
    "type": "object"
}

