{
	"_id": 101219,
	"id": "SumeruRose",
	"name": "スメールローズ",
	"description": "鮮やかな濃い紫色の花。人を立ち止まらせるほどの芳しい香りがする。ローズと呼ばれるが、厳密には玫瑰。",
	"recipes": [
		{
			"_id": 1302,
			"id": "LambadFishRoll",
			"name": "ランバドフィッシュロール"
		},
		{
			"_id": 2302,
			"id": "SelvaSalad",
			"name": "雨林サラダ"
		},
		{
			"_id": 2309,
			"id": "RoseCustard",
			"name": "ローズシュリカンド"
		},
		{
			"_id": 3308,
			"id": "CandiedAjilenakhNut",
			"name": "ナツメヤシキャンディ"
		},
		{
			"_id": 3309,
			"id": "PadisarahPudding",
			"name": "パティサラプリン"
		}
	],
	"source": [
		"野外で採集"
	]
}