{
	"_id": 101219,
	"id": "SumeruRose",
	"name": "Sumeru Rose",
	"description": "ดอกไม้สีม่วงที่ทั้งสดใสและสุขุม แผ่กลิ่นอายหอมหวนที่ทำให้ผู้คนต้องเหลียวกลับมามอง ถึงแม้จะได้ชื่อว่ากุหลาบ แต่แท้จริงแล้วเป็นดอกไม้ตระกูลอื่น",
	"recipes": [
		{
			"_id": 1302,
			"id": "LambadFishRoll",
			"name": "Lambad Fish Roll"
		},
		{
			"_id": 2302,
			"id": "SelvaSalad",
			"name": "Selva Salad"
		},
		{
			"_id": 2309,
			"id": "RoseCustard",
			"name": "Rose Custard"
		},
		{
			"_id": 3308,
			"id": "CandiedAjilenakhNut",
			"name": "Candied Ajilenakh Nut"
		},
		{
			"_id": 3309,
			"id": "PadisarahPudding",
			"name": "Padisarah Pudding"
		}
	],
	"source": [
		"พบได้ในโลกกว้าง"
	]
}