{
	"_id": 110010,
	"id": "Bacon",
	"name": "Tocino",
	"description": "Tiras de cerdo curadas. Crujientes y un poco grasientas.",
	"processing": [
		{
			"_id": 100061,
			"id": "RawMeat",
			"name": "Carne cruda",
			"amount": 2
		},
		{
			"_id": 100075,
			"id": "Salt",
			"name": "Sal",
			"amount": 2
		}
	],
	"recipes": [
		{
			"_id": 3003,
			"id": "ColdCutPlatter",
			"name": "Plato de carnes frías"
		},
		{
			"_id": 3215,
			"id": "Moreandmore",
			"name": "Más y más"
		},
		{
			"_id": 3404,
			"id": "PoissonchantPie",
			"name": "Pastel pezcanto"
		},
		{
			"_id": 3412,
			"id": "TomatesNarbonnaises",
			"name": "Tomates Narbonnais"
		}
	],
	"source": [
		"Procesar comida"
	]
}