{
	"_id": 110009,
	"id": "Cheese",
	"name": "Fromage",
	"description": "Produit à base de lait fermenté. Il peut être utilisé de façons variées pour agrémenter vos plats.",
	"processing": [
		{
			"_id": 100078,
			"id": "Milk",
			"name": "Lait",
			"amount": 3
		}
	],
	"recipes": [
		{
			"_id": 2303,
			"id": "MasalaCheeseBalls",
			"name": "Boules de fromage au masala"
		},
		{
			"_id": 2404,
			"id": "FontainianOnionSoup",
			"name": "Soupe fontainoise à l'oignon"
		},
		{
			"_id": 3006,
			"id": "MushroomPizza",
			"name": "Pizza aux champignons"
		},
		{
			"_id": 3008,
			"id": "PileEmUp",
			"name": "Empil'tout"
		},
		{
			"_id": 3304,
			"id": "PotatoBoat",
			"name": "Bateau-patate"
		},
		{
			"_id": 3306,
			"id": "MilkyMushroomCrispTower",
			"name": "Tour de champignons au lait"
		},
		{
			"_id": 3403,
			"id": "Lasagna",
			"name": "Lasagnes"
		},
		{
			"_id": 4205,
			"id": "SuperMagnificentPizza",
			"name": "Super pizza suprême"
		},
		{
			"_id": 4303,
			"id": "MeatLoversMushroomPizza",
			"name": "Pizza champignons-viande"
		}
	],
	"source": [
		"Cuisine (préparation)"
	]
}