{
	"_id": 100076,
	"id": "Onion",
	"name": "洋蔥",
	"description": "球狀的草本植物。為了報復切碎它的人，不管人的心情好壞都會讓他落淚。",
	"recipes": [
		{
			"_id": 2003,
			"id": "NorthernSmokedChicken",
			"name": "北地煙燻雞"
		},
		{
			"_id": 2008,
			"id": "FishermansToast",
			"name": "漁人吐司"
		},
		{
			"_id": 2306,
			"id": "CurryShrimp",
			"name": "咖哩蝦"
		},
		{
			"_id": 2403,
			"id": "TassesRagout",
			"name": "塔塞斯雜燴"
		},
		{
			"_id": 2404,
			"id": "FontainianOnionSoup",
			"name": "楓丹洋蔥湯"
		},
		{
			"_id": 3009,
			"id": "BarbatosRatatouille",
			"name": "風神雜燴菜"
		},
		{
			"_id": 3210,
			"id": "BraisedMeat",
			"name": "紅燴獸肉"
		},
		{
			"_id": 3312,
			"id": "SabzMeatStew",
			"name": "薩布茲燉肉"
		},
		{
			"_id": 3313,
			"id": "ScentedMeatBalls",
			"name": "秘香肉團"
		},
		{
			"_id": 3315,
			"id": "GildedTajine",
			"name": "鍍金鍋"
		},
		{
			"_id": 3406,
			"id": "SteakTartare",
			"name": "生肉塔塔"
		},
		{
			"_id": 3411,
			"id": "TripesDuPort",
			"name": "港灣牛肚"
		},
		{
			"_id": 3412,
			"id": "TomatesNarbonnaises",
			"name": "納博內番茄盅"
		},
		{
			"_id": 3418,
			"id": "Feastos",
			"name": "圈圈圓圓"
		},
		{
			"_id": 4204,
			"id": "BountifulYear",
			"name": "豐年有餘"
		}
	],
	"source": [
		"雜貨店購買"
	]
}