{
	"_id": 100016,
	"id": "Mint",
	"name": "Bạc Hà",
	"description": "Loại lá có thành phần làm mát. Mùi vị thanh mát sảng khoái đánh tan cái nóng của mùa hè.",
	"recipes": [
		{
			"_id": 1005,
			"id": "RadishVeggieSoup",
			"name": "Canh Rau Củ"
		},
		{
			"_id": 1007,
			"id": "MintJelly",
			"name": "Thạch Bạc Hà"
		},
		{
			"_id": 1301,
			"id": "MintyBeanSoup",
			"name": "Canh Đậu Bạc Hà"
		},
		{
			"_id": 2111,
			"id": "MintSalad",
			"name": "Rau Trộn Bạc Hà"
		},
		{
			"_id": 2302,
			"id": "SelvaSalad",
			"name": "Salad Nhiệt Đới"
		},
		{
			"_id": 2307,
			"id": "FishWithCreamSauce",
			"name": "Cá Tươi Sốt Kem"
		},
		{
			"_id": 2311,
			"id": "Fatteh",
			"name": "Fatteh"
		},
		{
			"_id": 3001,
			"id": "CallaLilySeafoodSoup",
			"name": "Súp Hải Sản Hoa Calla Lily"
		},
		{
			"_id": 3003,
			"id": "ColdCutPlatter",
			"name": "Thịt Lạnh"
		},
		{
			"_id": 3013,
			"id": "CrispyPotatoShrimpPlatter",
			"name": "Giỏ Khoai Giòn Tôm Tươi"
		},
		{
			"_id": 3112,
			"id": "MintyMeatRolls",
			"name": "Thịt Rừng Cuộn Bạc Hà"
		},
		{
			"_id": 3220,
			"id": "RainbowAster",
			"name": "Tử Uyển Cầu Vồng"
		},
		{
			"_id": 3316,
			"id": "MintyFruitTea",
			"name": "Trà Trái Cây Bạc Hà"
		},
		{
			"_id": 3407,
			"id": "PoissonSeafoodSoup",
			"name": "Súp Hải Sản Poisson"
		}
	],
	"source": [
		"Thu Thập Bên Ngoài"
	]
}