{
	"_id": 101210,
	"id": "Seagrass",
	"name": "Морская водоросль",
	"description": "Произрастает на морском мелководье. Придаёт блюдам своеобразный вкус.",
	"recipes": [
		{
			"_id": 1203,
			"id": "MisoSoup",
			"name": "Мисо-суп"
		},
		{
			"_id": 1206,
			"id": "SobaNoodles",
			"name": "Соба"
		},
		{
			"_id": 2202,
			"id": "Onigiri",
			"name": "Онигири"
		},
		{
			"_id": 2206,
			"id": "Wakatakeni",
			"name": "Вакатакэни"
		},
		{
			"_id": 2210,
			"id": "UdonNoodles",
			"name": "Лапша удон"
		},
		{
			"_id": 3212,
			"id": "InvigoratingKittyMeal",
			"name": "Бодрящее кошачье лакомство"
		},
		{
			"_id": 3216,
			"id": "UnagiChazuke",
			"name": "Унаги тядзукэ"
		},
		{
			"_id": 3217,
			"id": "FivePickledTreasures",
			"name": "Пять драгоценных солений"
		},
		{
			"_id": 4202,
			"id": "ButterCrab",
			"name": "Краб в масле"
		}
	],
	"source": [
		"Акватория Инадзумы"
	]
}