{
	"_id": 100084,
	"id": "Fish",
	"name": "생선 살코기",
	"description": "생선의 신선한 살코기. 적절히 조리하면 아주 맛있는 요리가 된다",
	"processing": [
		{
			"_id": 131000,
			"id": "Medaka",
			"name": "구피",
			"amount": 1
		}
	],
	"recipes": [
		{
			"_id": 1006,
			"id": "MondstadtGrilledFish",
			"name": "몬드 생선구이"
		},
		{
			"_id": 1103,
			"id": "GrilledTigerFish",
			"name": "흘호어 구이"
		},
		{
			"_id": 1202,
			"id": "DrybraisedSaltedFish",
			"name": "은어조림"
		},
		{
			"_id": 1302,
			"id": "LambadFishRoll",
			"name": "람바드 생선 롤"
		},
		{
			"_id": 1402,
			"id": "TroutAmandine",
			"name": "송어 아망딘"
		},
		{
			"_id": 2113,
			"id": "StirfriedFishNoodles",
			"name": "생선 볶음면"
		},
		{
			"_id": 2201,
			"id": "TunaSushi",
			"name": "참치 초밥"
		},
		{
			"_id": 2202,
			"id": "Onigiri",
			"name": "주먹밥"
		},
		{
			"_id": 2207,
			"id": "RadishAndFishStew",
			"name": "생선 무조림"
		},
		{
			"_id": 2209,
			"id": "Sangayaki",
			"name": "산가야키"
		},
		{
			"_id": 2210,
			"id": "UdonNoodles",
			"name": "우동"
		},
		{
			"_id": 2307,
			"id": "FishWithCreamSauce",
			"name": "크림소스 생선"
		},
		{
			"_id": 2406,
			"id": "FontaineAspic",
			"name": "아스픽"
		},
		{
			"_id": 3012,
			"id": "SunshineSprat",
			"name": "버터 생선 구이"
		},
		{
			"_id": 3101,
			"id": "ZhongyuanChopSuey",
			"name": "중원 내장꼬치"
		},
		{
			"_id": 3102,
			"id": "BlackbackPerchStew",
			"name": "삶은 검정 농어"
		},
		{
			"_id": 3103,
			"id": "SquirrelFish",
			"name": "탕수어"
		},
		{
			"_id": 3105,
			"id": "ComeAndGetIt",
			"name": "흥얼채"
		},
		{
			"_id": 3111,
			"id": "FullmoonEgg",
			"name": "명월 딤섬"
		},
		{
			"_id": 3207,
			"id": "RiceCakeSoup",
			"name": "모둠 어묵탕"
		},
		{
			"_id": 3212,
			"id": "InvigoratingKittyMeal",
			"name": "활력충만 고양이 밥"
		},
		{
			"_id": 3215,
			"id": "Moreandmore",
			"name": "다다야끼"
		},
		{
			"_id": 3303,
			"id": "Tahchin",
			"name": "타친"
		},
		{
			"_id": 3402,
			"id": "FishAndChips",
			"name": "피시 앤 칩스"
		},
		{
			"_id": 3404,
			"id": "PoissonchantPie",
			"name": "물고기 영창 파이"
		},
		{
			"_id": 3407,
			"id": "PoissonSeafoodSoup",
			"name": "푸아송 해물 수프"
		},
		{
			"_id": 3418,
			"id": "Feastos",
			"name": "동글동글"
		},
		{
			"_id": 4201,
			"id": "SashimiPlatter",
			"name": "모둠 회"
		},
		{
			"_id": 4204,
			"id": "BountifulYear",
			"name": "풍요로운 한 해"
		}
	],
	"source": [
		"어류를 포획하여 채집"
	]
}