{
	"_id": 100080,
	"id": "Potato",
	"name": "Batata",
	"description": "É uma planta perene da família das solanáceas. Um presente da terra devido aos seus vários métodos de preparado.",
	"recipes": [
		{
			"_id": 1401,
			"id": "DuckConfit",
			"name": "Confit de Pato"
		},
		{
			"_id": 2007,
			"id": "SatisfyingSalad",
			"name": "Salada Saudável"
		},
		{
			"_id": 2010,
			"id": "FragrantMashedPotatoes",
			"name": "Purê de Batatas Aromatizado"
		},
		{
			"_id": 2107,
			"id": "GoldenShrimpBalls",
			"name": "Almôndegas Douradas de Camarão"
		},
		{
			"_id": 2110,
			"id": "StoneHarborDelicacies",
			"name": "Iguarias do Porto de Pedra"
		},
		{
			"_id": 2303,
			"id": "MasalaCheeseBalls",
			"name": "Bolinhas de Queijo ao Masala"
		},
		{
			"_id": 2305,
			"id": "Panipuri",
			"name": "Panipuri"
		},
		{
			"_id": 3007,
			"id": "MondstadtHashBrown",
			"name": "Bolinho de Batata de Mondstadt"
		},
		{
			"_id": 3008,
			"id": "PileEmUp",
			"name": "\"Empilhar\""
		},
		{
			"_id": 3009,
			"id": "BarbatosRatatouille",
			"name": "Ensopado do Arconte Anemo"
		},
		{
			"_id": 3013,
			"id": "CrispyPotatoShrimpPlatter",
			"name": "Prato de Camarão e Batata Crocante"
		},
		{
			"_id": 3210,
			"id": "BraisedMeat",
			"name": "Carne Bestial Vermelha"
		},
		{
			"_id": 3218,
			"id": "SakuraShrimpCrackers",
			"name": "Biscoitos de Sakura e Camarão"
		},
		{
			"_id": 3304,
			"id": "PotatoBoat",
			"name": "Navio de Batata"
		},
		{
			"_id": 3402,
			"id": "FishAndChips",
			"name": "Peixe e Batatas Fritas"
		},
		{
			"_id": 3418,
			"id": "Feastos",
			"name": "Redondinho"
		},
		{
			"_id": 4402,
			"id": "Haggis",
			"name": "Haggis"
		}
	],
	"source": [
		"Vendido nas Tendas"
	]
}