{
	"_id": 110010,
	"id": "Bacon",
	"name": "Thịt Xông Khói",
	"description": "Thịt pha gân được hun khói. Nhiều lớp, béo mà không ngán, rất được yêu thích.",
	"processing": [
		{
			"_id": 100061,
			"id": "RawMeat",
			"name": "Thịt Rừng",
			"amount": 2
		},
		{
			"_id": 100075,
			"id": "Salt",
			"name": "Muối",
			"amount": 2
		}
	],
	"recipes": [
		{
			"_id": 3003,
			"id": "ColdCutPlatter",
			"name": "Thịt Lạnh"
		},
		{
			"_id": 3215,
			"id": "Moreandmore",
			"name": "Toto Nướng"
		},
		{
			"_id": 3404,
			"id": "PoissonchantPie",
			"name": "Bánh Poissonchant"
		},
		{
			"_id": 3412,
			"id": "TomatesNarbonnaises",
			"name": "Cà Dồn Narbonnaise"
		}
	],
	"source": [
		"Nhận khi gia công nấu nướng"
	]
}