{
	"_id": 100089,
	"id": "Almond",
	"name": "杏仁",
	"description": "有着奇特香味的种子。能给食物带来全然不同的清新风味。",
	"recipes": [
		{
			"_id": 1402,
			"id": "TroutAmandine",
			"name": "杏仁鳟鱼"
		},
		{
			"_id": 2101,
			"id": "AlmondTofu",
			"name": "杏仁豆腐"
		},
		{
			"_id": 3108,
			"id": "LotusFlowerCrisp",
			"name": "莲花酥"
		},
		{
			"_id": 3308,
			"id": "CandiedAjilenakhNut",
			"name": "枣椰蜜糖"
		},
		{
			"_id": 3416,
			"id": "LaLettreAFocalors",
			"name": "致水神"
		},
		{
			"_id": 3419,
			"id": "RainbowMacarons",
			"name": "缤纷马卡龙"
		}
	],
	"source": [
		"璃月杂货店购买",
		"枫丹杂货店购买"
	]
}