{
	"_id": 100096,
	"id": "GlabrousBeans",
	"name": "반질반질콩",
	"description": "티바트에서 흔히 볼 수 있는 콩류 작물. 은은한 향을 풍기고 있으며 활용 방법이 다양한 덕분에 각지의 주민들에게 인기를 끌고 있다",
	"recipes": [
		{
			"_id": 1301,
			"id": "MintyBeanSoup",
			"name": "완두콩 민트 수프"
		},
		{
			"_id": 2305,
			"id": "Panipuri",
			"name": "파니푸리"
		},
		{
			"_id": 2308,
			"id": "AaruMixedRice",
			"name": "아루 비빔밥"
		},
		{
			"_id": 2311,
			"id": "Fatteh",
			"name": "팟타"
		},
		{
			"_id": 3414,
			"id": "Cassoulet",
			"name": "카술레"
		}
	],
	"source": [
		"수메르 레스토랑 구매",
		"폰타인 잡화점 구매"
	]
}