{
	"_id": 101221,
	"id": "AjilenakhNut",
	"name": "Quả Ajilenakh",
	"description": "Quả của cây thường xanh trong ốc đảo sa mạc. Dưới lớp vỏ cứng là lớp thịt dày, ngọt và thơm ngon, là nguồn lương thực quan trọng của người dân nơi biển cát.",
	"recipes": [
		{
			"_id": 3307,
			"id": "Baklava",
			"name": "Baklava"
		},
		{
			"_id": 3308,
			"id": "CandiedAjilenakhNut",
			"name": "Ajilenakh Ngào Đường"
		},
		{
			"_id": 3310,
			"id": "CharcoalbakedAjilenakhCake",
			"name": "Bánh Ajilenakh Nướng"
		}
	],
	"source": [
		"Thu thập ở ốc đảo sa mạc Sumeru"
	]
}