{
	"_id": 100092,
	"id": "Rice",
	"name": "Рис",
	"description": "Зерновая культура, широко распространённая в Тейвате. Нет человека, который не восхищался бы формой и питательностью рисовых зёрен. Вот почему часто говорят: «Один и тот же рис способен вскормить сотню разных людей»",
	"recipes": [
		{
			"_id": 1104,
			"id": "RiceBuns",
			"name": "Рисовые пампушки"
		},
		{
			"_id": 1204,
			"id": "SweetShrimpSushi",
			"name": "Суши с креветками"
		},
		{
			"_id": 1205,
			"id": "BirdEggSushi",
			"name": "Яичные суши"
		},
		{
			"_id": 2105,
			"id": "CrystalShrimp",
			"name": "Кристальные баоцзы"
		},
		{
			"_id": 2113,
			"id": "StirfriedFishNoodles",
			"name": "Жареная лапша с рыбой"
		},
		{
			"_id": 2201,
			"id": "TunaSushi",
			"name": "Суши с тунцом"
		},
		{
			"_id": 2202,
			"id": "Onigiri",
			"name": "Онигири"
		},
		{
			"_id": 2208,
			"id": "BerryMizuManjuu",
			"name": "Ягодный мидзу мандзю"
		},
		{
			"_id": 2308,
			"id": "AaruMixedRice",
			"name": "Пилав Аару"
		},
		{
			"_id": 3105,
			"id": "ComeAndGetIt",
			"name": "Налетайка"
		},
		{
			"_id": 3109,
			"id": "UniversalPeace",
			"name": "«Благоденствие»"
		},
		{
			"_id": 3110,
			"id": "JueyunGuoba",
			"name": "Заоблачный гоба"
		},
		{
			"_id": 3201,
			"id": "TricolorDango",
			"name": "Трёхцветное данго"
		},
		{
			"_id": 3205,
			"id": "SakuraMochi",
			"name": "Моти с сакурой"
		},
		{
			"_id": 3209,
			"id": "RicePudding",
			"name": "Рисовый пудинг"
		},
		{
			"_id": 3212,
			"id": "InvigoratingKittyMeal",
			"name": "Бодрящее кошачье лакомство"
		},
		{
			"_id": 3213,
			"id": "OmeletteRice",
			"name": "Рисовый омлет"
		},
		{
			"_id": 3216,
			"id": "UnagiChazuke",
			"name": "Унаги тядзукэ"
		},
		{
			"_id": 3303,
			"id": "Tahchin",
			"name": "Тахчин"
		},
		{
			"_id": 4301,
			"id": "Biryani",
			"name": "Бирьяни"
		}
	],
	"source": [
		"Лавки Ли Юэ",
		"Торговые лавки Инадзумы",
		"Лавки Сумеру"
	]
}