{
	"_id": 101218,
	"id": "ZaytunPeach",
	"name": "Pêssego Zaytun",
	"description": "Fruto de um arbusto na floresta. A sua carne é firme e o sabor é doce. Dizem que serve para tranquilizar a mente.",
	"recipes": [
		{
			"_id": 2302,
			"id": "SelvaSalad",
			"name": "Salada Tropical"
		}
	],
	"source": [
		"Encontrado na natureza"
	]
}