{
	"_id": 100098,
	"id": "CoffeeBeans",
	"name": "Coffee Beans",
	"description": "A common fruit in Teyvat with a special aroma. It can be used to make beverages after being ground.",
	"recipes": [
		{
			"_id": 3314,
			"id": "Tulumba",
			"name": "Tulumba"
		},
		{
			"_id": 3410,
			"id": "CoffeeBavarois",
			"name": "Coffee Bavarois"
		},
		{
			"_id": 3416,
			"id": "LaLettreAFocalors",
			"name": "La Lettre a Focalors"
		}
	],
	"source": [
		"Sold at cafés in Sumeru",
		"Sold at cafés in Fontaine"
	]
}