{
	"_id": 100099,
	"id": "FermentedJuice",
	"name": "Fermented Juice",
	"description": "น้ำผลไม้จากการหมักบ่ม ที่มีกลิ่นหอมอันเป็นเอกลักษณ์ของผลไม้ มักจะใช้ปรุงรสตอนทำอาหารเมนูเนื้อสัตว์",
	"recipes": [
		{
			"_id": 3411,
			"id": "TripesDuPort",
			"name": "Tripes du Port"
		},
		{
			"_id": 4401,
			"id": "VessieChicken",
			"name": "Vessie Chicken"
		}
	],
	"source": [
		"ซื้อจากร้านขายของชำใน Fontaine"
	]
}