{
	"_id": 101219,
	"id": "SumeruRose",
	"name": "Rose sumérienne",
	"description": "Vives et belles, ces fleurs d'un violet pur dégagent un parfum agréable qui fera s'arrêter toute personne passant devant elles. Leur nom peut porter à confusion, car bien qu'elles soient des roses, elles sont semblables à nulle autre fleur de la même classification florale.",
	"recipes": [
		{
			"_id": 1302,
			"id": "LambadFishRoll",
			"name": "Rouleau au poisson de Lambad"
		},
		{
			"_id": 2302,
			"id": "SelvaSalad",
			"name": "Salade de selve"
		},
		{
			"_id": 2309,
			"id": "RoseCustard",
			"name": "Crème à la rose"
		},
		{
			"_id": 3308,
			"id": "CandiedAjilenakhNut",
			"name": "Nougat d'ajilenakh"
		},
		{
			"_id": 3309,
			"id": "PadisarahPudding",
			"name": "Pudding de padisachidées"
		}
	],
	"source": [
		"Dans la nature"
	]
}