{
	"_id": 101221,
	"id": "AjilenakhNut",
	"name": "Noix d'ajilenakh",
	"description": "Un fruit qui pousse sur les arbres à feuilles persistantes dans les oasis du désert. La chair sous sa peau dure est épaisse, sucrée et délicieuse, ce qui en fait une source de nourriture importante parmi les peuples du désert.",
	"recipes": [
		{
			"_id": 3307,
			"id": "Baklava",
			"name": "Baklava"
		},
		{
			"_id": 3308,
			"id": "CandiedAjilenakhNut",
			"name": "Nougat d'ajilenakh"
		},
		{
			"_id": 3310,
			"id": "CharcoalbakedAjilenakhCake",
			"name": "Charbon d'ajilenakh"
		}
	],
	"source": [
		"Oasis des déserts de Sumeru"
	]
}