{
	"_id": 100018,
	"id": "Cabbage",
	"name": "Cabbage",
	"description": "A layered, leafy vegetable. Said to have originally been an ornamental plant, it certainly looks great in the pot.",
	"recipes": [
		{
			"_id": 2003,
			"id": "NorthernSmokedChicken",
			"name": "Northern Smoked Chicken"
		},
		{
			"_id": 2007,
			"id": "SatisfyingSalad",
			"name": "Satisfying Salad"
		},
		{
			"_id": 2203,
			"id": "MixedYakisoba",
			"name": "Mixed Yakisoba"
		},
		{
			"_id": 2211,
			"id": "KatsuSandwich",
			"name": "Katsu Sandwich"
		},
		{
			"_id": 3005,
			"id": "CrabHamVeggieBake",
			"name": "Crab, Ham & Veggie Bake"
		},
		{
			"_id": 3006,
			"id": "MushroomPizza",
			"name": "Mushroom Pizza"
		},
		{
			"_id": 3014,
			"id": "GoldenChickenBurger",
			"name": "Golden Chicken Burger"
		},
		{
			"_id": 3104,
			"id": "QingceStirFry",
			"name": "Qingce Stir Fry"
		},
		{
			"_id": 4101,
			"id": "JadeParcels",
			"name": "Jade Parcels"
		},
		{
			"_id": 4203,
			"id": "ChiliminceCornbreadBuns",
			"name": "Chili-Mince Cornbread Buns"
		}
	],
	"source": [
		"Found in the wild",
		"Sold at general goods shops"
	]
}