{
	"_id": 100014,
	"id": "Radish",
	"name": "흰 무",
	"description": "섬유질이 풍부한 초본식물. 쉽게 재배할 수 있으며, 섬유질과 영양가가 풍부하다",
	"recipes": [
		{
			"_id": 1005,
			"id": "RadishVeggieSoup",
			"name": "무 수프"
		},
		{
			"_id": 2006,
			"id": "FriedRadishBalls",
			"name": "무완자 튀김"
		},
		{
			"_id": 2207,
			"id": "RadishAndFishStew",
			"name": "생선 무조림"
		},
		{
			"_id": 3217,
			"id": "FivePickledTreasures",
			"name": "다섯 보물 쓰케모노"
		},
		{
			"_id": 4201,
			"id": "SashimiPlatter",
			"name": "모둠 회"
		},
		{
			"_id": 4402,
			"id": "Haggis",
			"name": "해기스"
		}
	],
	"source": [
		"야외 채집"
	]
}