{
	"_id": 110011,
	"id": "Sausage",
	"name": "소시지",
	"description": "창자에 고기를 갈아 넣은 소시지. 저장이 용이하여 고기 애호가들이 일상적으로 즐긴다",
	"processing": [
		{
			"_id": 100061,
			"id": "RawMeat",
			"name": "짐승고기",
			"amount": 3
		}
	],
	"recipes": [
		{
			"_id": 3003,
			"id": "ColdCutPlatter",
			"name": "냉채수육"
		},
		{
			"_id": 3207,
			"id": "RiceCakeSoup",
			"name": "모둠 어묵탕"
		},
		{
			"_id": 3414,
			"id": "Cassoulet",
			"name": "카술레"
		}
	],
	"source": [
		"요리 가공 획득"
	]
}