{
	"_id": 110003,
	"id": "SmokedFowl",
	"name": "Копчёная птица",
	"description": "Копчёное мясо птицы. Запах дыма придаёт блюдам новый вкус.",
	"processing": [
		{
			"_id": 100064,
			"id": "Fowl",
			"name": "Мясо птицы",
			"amount": 3
		},
		{
			"_id": 100075,
			"id": "Salt",
			"name": "Соль",
			"amount": 1
		}
	],
	"recipes": [
		{
			"_id": 2003,
			"id": "NorthernSmokedChicken",
			"name": "Копчёный цыплёночек"
		}
	],
	"source": [
		"Заготовка ингредиентов"
	]
}