{
	"_id": 100063,
	"id": "Matsutake",
	"name": "Matsutake",
	"description": "Um fungo raro que geralmente cresce sobre ou perto de pinheiros. Seu aroma delicado revela sua localização.",
	"recipes": [
		{
			"_id": 2104,
			"id": "MatsutakeMeatRolls",
			"name": "Rolinho de Carne com Matsutake"
		},
		{
			"_id": 2109,
			"id": "VegetarianAbalone",
			"name": "Abalone Vegetariano"
		},
		{
			"_id": 2110,
			"id": "StoneHarborDelicacies",
			"name": "Iguarias do Porto de Pedra"
		},
		{
			"_id": 3002,
			"id": "SautedMatsutake",
			"name": "Matsutake Salteado"
		},
		{
			"_id": 3113,
			"id": "CuredPorkDryHotpot",
			"name": "Porco Curado com Matsutake"
		},
		{
			"_id": 4103,
			"id": "TianshuMeat",
			"name": "Carne de Tianshu"
		},
		{
			"_id": 4202,
			"id": "ButterCrab",
			"name": "Caranguejo na Manteiga"
		},
		{
			"_id": 5101,
			"id": "AdeptusTemptation",
			"name": "Tentação do Adeptus"
		}
	],
	"source": [
		"Encontrado na natureza"
	]
}